{
  "law_id": "perturb-wind-glide",
  "version": "1.0.0",
  "kind": "physical",
  "class": "theorem-from-hypothesis",
  "status": "candidate",
  "label": null,
  "level": null,
  "lean_ref": {
    "module": "lean/Delphi/Perturb.lean",
    "theorem": "Delphi.Perturb.wind_glide_rules_out",
    "structure": null,
    "commit": "ba62f1688beb79c27f21cd3a3c060f66c674c2df",
    "statement_sha256": "890734e43ac7f23fcf20f235a51c51ec44bde888e4258a3bf1388216cd7f96e6",
    "content_hash": "051af87a59713dd3f9b05d067ef5171ee160133322bf77101f723fb6d4fdef35"
  },
  "statement_en": "A steady glide from height h in an along-track wind w (positive tailwind) covers at most h (L/D)max (1 + w/u) over the ground; a longer claimed ground range is ruled out.",
  "hypotheses": [
    {
      "name": "see theorem statement",
      "statement": "the named hypothesis structure(s) in the theorem statement; instantiated with fetched numbers in Delphi.Perturb.measured"
    }
  ],
  "scope": {
    "taxa": [
      "any"
    ],
    "life_stages": [],
    "ranges": {},
    "basis": "pure kinematics; no source needed"
  },
  "shared_scope": null,
  "evidence": {
    "sources": [],
    "observations": []
  },
  "sources": [],
  "non_vacuity_witness": {
    "lean": "Delphi.Registry.windGlide_model_witness",
    "statement": "theorem windGlide_model_witness : ∃ u s h w x LDmax : ℝ, 0 < u ∧ 0 < s ∧ 0 ≤ h ∧ -u ≤ w ∧ u / s ≤ LDmax ∧ x = (u + w) * (h / s)",
    "file": "lean/registry/lean/Witnesses.lean"
  },
  "constraints": [
    "P4b"
  ],
  "introduced_in": "1.1.0",
  "supersedes": null,
  "superseded_by": null,
  "retired_reason": null,
  "contested_with": [],
  "approval": null,
  "origin": {
    "by_role": "perturbation-thread",
    "kind": "agent",
    "from": "lean/Delphi/Perturb.lean (registered by the registry thread)"
  },
  "history": [
    {
      "version": "1.0.0",
      "date": "2026-11-01",
      "change": "propose.mjs against lawset 1.0.0: candidate"
    }
  ],
  "content_hash": "051af87a59713dd3f9b05d067ef5171ee160133322bf77101f723fb6d4fdef35"
}
