{
  "law_id": "thompson1917-ch03-07",
  "version": "1.0.0",
  "kind": "physical",
  "class": "theorem",
  "status": "accepted",
  "label": "Weight tends to vary as the cube of linear dimensions during growth",
  "level": "phenotype",
  "lean_ref": {
    "module": "lean/Delphi/Thompson.lean",
    "theorem": "Delphi.cubeLaw_loglog_exponent",
    "structure": null,
    "commit": "ba62f1688beb79c27f21cd3a3c060f66c674c2df",
    "statement_sha256": "7cc70b3bcb9192f8110416a87fdf00d13a61bc33f4a38bc5582bdeb72d070b74",
    "content_hash": "2e54b441d95290ca4e76eb543d1c79805e51ab50fbdd774b349e72d164a7a9ea"
  },
  "statement_en": "Whatever the law of increase in a linear dimension, volume and therefore weight tend to vary as the cube of linear dimensions, which mainly (though not wholly) explains why the human weight curve differs in shape from the stature curve.",
  "hypotheses": [
    {
      "name": "thompson1917-ch03-07#assumed-1",
      "statement": "A single linear dimension L and mass W of one body family; fixed shape and constant density are what W = k L^3 encodes."
    },
    {
      "name": "thompson1917-ch03-07#assumed-2",
      "statement": "Thompson's \"mainly (though not wholly)\" is not formalised: the theorem is exact, the law is approximate, and the tolerance band [2.5, 3.5] the claim test uses is a decision rule outside the module."
    },
    {
      "name": "thompson1917-ch03-07#assumed-3",
      "statement": "No data enters the module; the measured exponents are read from the claims thread's result files and pointed to."
    }
  ],
  "scope": {
    "taxa": [
      "any"
    ],
    "life_stages": [],
    "ranges": {},
    "basis": "a theorem about a model: it applies wherever the design supplies the quantities it uses and accepts the hypotheses in scope.assumed",
    "kernelChecked": [
      "If W L = k L^3 for all L > 0 with k > 0, then for L1 ≠ L2 the log-log slope (log W L2 − log W L1)/(log L2 − log L1) equals exactly 3 (cubeLaw_loglog_exponent) and W L2 / W L1 = (L2/L1)^3 (cubeLaw_ratio).",
      "Contrapositive: two sizes with a log-log slope b ≠ 3 rule out W = k L^3 for every k (not_cubeLaw_of_exponent_ne_three)."
    ],
    "assumed": [
      "A single linear dimension L and mass W of one body family; fixed shape and constant density are what W = k L^3 encodes.",
      "Thompson's \"mainly (though not wholly)\" is not formalised: the theorem is exact, the law is approximate, and the tolerance band [2.5, 3.5] the claim test uses is a decision rule outside the module.",
      "No data enters the module; the measured exponents are read from the claims thread's result files and pointed to."
    ],
    "note": null
  },
  "constraint_scopes": {
    "C7b": {
      "taxa": [
        "Exocoetidae"
      ],
      "life_stages": [],
      "ranges": {},
      "basis": "evaluated against one reference specimen (Cypselurus hiraii, Park and Choi 2010 Table 1 model L3); an isometric family is one body plan, so other clades are out of scope"
    }
  },
  "shared_scope": null,
  "evidence": {
    "sources": [
      "On Growth and Form (1917)"
    ],
    "observations": [],
    "faithfulness": "not assessed",
    "flyingFishAudit": {
      "holds": 2,
      "cannot-evaluate": 1
    },
    "rejectable": null
  },
  "sources": [
    "On Growth and Form (1917)"
  ],
  "non_vacuity_witness": {
    "lean": "Delphi.Registry.cubeLaw_witness",
    "file": "lean/registry/lean/Witnesses.lean",
    "statement": "CubeLaw (fun L => L^3) 1"
  },
  "constraints": [
    "C7",
    "C7b"
  ],
  "introduced_in": "1.0.0",
  "supersedes": null,
  "superseded_by": null,
  "retired_reason": null,
  "contested_with": [],
  "approval": {
    "approved_by_role": "bootstrap-grandfathered",
    "date": "2026-11-01",
    "basis": "in force in lean/constraints.json / lean/laws.json before the registry existed; no per-law human review recorded by the registry"
  },
  "origin": {
    "by_role": "lean-thread",
    "kind": "bootstrap",
    "from": "lean/laws.json"
  },
  "history": [
    {
      "version": "1.0.0",
      "date": "2026-11-01",
      "change": "bootstrapped from lean/laws.json (status there: \"proved\")"
    }
  ],
  "content_hash": "2e54b441d95290ca4e76eb543d1c79805e51ab50fbdd774b349e72d164a7a9ea"
}
